{
  "$id": "template",
  "$schema": "https://json-schema.org/draft/2020-12/schema",
  "title": "template",
  "type": "object",
  "properties": {
    "execute_on": {
      "anyOf": [
        { "const": "ve" },
        { "const": "lxc" },
        { "const": "hook", "description": "Deploy the script as an on-start hook into the container's /etc/proxvex/on_start.d/. The hook is executed by the on_start_container dispatcher on every container start (and optionally once immediately, see hook_trigger_now)." },
        { "type": "string", "pattern": "^host:.*$" },
        { "type": "string", "pattern": "^application:.*$" },
        {
          "type": "object",
          "properties": {
            "where": {
              "anyOf": [
                { "const": "ve" },
                { "const": "lxc" },
                { "const": "hook" },
                { "type": "string", "pattern": "^host:.*$" },
                { "type": "string", "pattern": "^application:.*$" }
              ]
            },
            "uid": { "type": "boolean", "description": "Run as the application's uid (from application.json)" },
            "gid": { "type": "boolean", "description": "Run as the application's gid (from application.json)" }
          },
          "required": ["where"],
          "additionalProperties": false
        }
      ]
    },
    "hook_trigger_now": {
      "type": "boolean",
      "description": "When execute_on is 'hook': also trigger the deployed hook once immediately (default true). Set false if you only want it deployed for the next container restart."
    },
    "skip_if_all_missing": {
      "type": "array",
      "items": { "type": "string" },
      "minItems": 1,
      "description": "List of parameter IDs. If ALL of these are missing or empty, the template will be skipped. If at least one parameter is present, the template will be executed. If this property is present (and not empty), the template is considered optional."
    },
    "persists_container_state": {
      "type": "boolean",
      "description": "Marks templates that mutate persistent container state (files inside the LXC, e.g. /etc/docker/daemon.json, /etc/hosts entries, on-start hook scripts). The container-state-templates validator (backend/scripts/validateContainerStateTemplates.mjs) requires every application that references such a template in any of installation/upgrade/reconfigure to reference it in ALL three — otherwise an upgrade or reconfigure silently drops the change and the container drifts."
    },
    "reconfigurable": {
      "type": "boolean",
      "description": "Marks templates that implement a hardware/LXC action (USB device passthrough, idmap, etc.) driven by user-visible parameters. Such templates must also run on reconfigure so that changing a complex parameter (e.g. host_device_path) actually re-applies the action against the cloned target container. Auto-wiring in application-persistence-handler appends every reconfigurable template referenced in installation.<phase> to reconfigure.<phase> unless the application's reconfigure block uses no_extend: true. The frontend may surface a 'reconfigure-relevant' hint on the parameters listed under such a template."
    },
    "skip_if_property_set": {
      "type": "string",
      "description": "Parameter ID. If this parameter is set (exists in resolvedParams), the template will be skipped."
    },
    "name": {
      "type": "string",
      "maxLength": 30
    },
    "description": {
      "type": "string"
    },
    "parameters": {
      "type": "array",
      "description": "Parameter IDs referenced from this template. The canonical definition for each ID lives in json/shared/parameter-definitions.json. (Inline objects are accepted as a transitional form for legacy/backup directories.)",
      "items": {
        "anyOf": [
          {
            "type": "string",
            "pattern": "^[A-Za-z_][A-Za-z0-9_.-]*$"
          },
          {
            "type": "object",
            "$comment": "Legacy inline form — accepted only for backup/transitional templates, not for new code.",
            "properties": {
              "id": { "type": "string" },
              "name": { "type": "string" },
              "type": { "enum": ["string", "number", "enum", "boolean"] },
              "description": { "type": "string" },
              "multiline": { "type": "boolean" },
              "upload": { "type": "boolean" },
              "certtype": { "type": "string" },
              "required": { "type": "boolean" },
              "secure": { "type": "boolean" },
              "advanced": { "type": "boolean" },
              "internal": { "type": "boolean" },
              "default": { "type": ["string", "number", "boolean"] },
              "enumValues": { "type": "array" },
              "enumValuesTemplate": { "type": "string" },
              "validatePattern": { "type": "string" },
              "if": { "type": "string" }
            },
            "required": ["id"]
          }
        ]
      }
    },
    "commands": {
      "type": "array",
      "minItems": 1,
      "items": { "$ref": "#/$defs/command" }
    }
  },
  "if": {
    "properties": { "type": { "enum": ["command", "script", "template"] } }
  },
  "then": { "properties": { "enumValues": { "type": "string" } } },
  "required": ["commands", "name"],
  "additionalProperties": false,
  "$defs": {
    "command": {
      "type": "object",
      "properties": {
        "name": { "type": "string", "maxLength": 30 },
        "description": { "type": "string" },
        "command": { "type": "string" },
        "script": { "type": "string" },
        "library": {
          "oneOf": [
            { "type": "string" },
            { "type": "array", "items": { "type": "string" } }
          ],
          "description": "Optional: Library file(s) to prepend to script content. String or array of strings."
        },
        "outputs": {
          "type": "array",
          "items": { "$ref": "output.template#" },
          "description": "Expected outputs from this command/script. If outputs are defined here, they will be validated after execution. If outputs are missing, an error will be raised."
        },
        "properties": {
          "description": "Sets parameter values (outputs). Use 'value' to set a resolved value (not editable), or 'default' to set a default value (editable by user). If a template has only one command with properties (and no script, command, or template), it is considered a properties-only template.",
          "oneOf": [
            {
              "type": "object",
              "properties": {
                "id": { "type": "string" },
                "value": {
                  "oneOf": [
                    { "type": ["string", "boolean", "number"] },
                    {
                      "type": "array",
                      "items": {
                        "oneOf": [
                          { "type": "string" },
                          {
                            "type": "object",
                            "properties": {
                              "name": { "type": "string" },
                              "value": { "type": ["string", "number", "boolean"] }
                            },
                            "required": ["name", "value"],
                            "additionalProperties": false
                          },
                          {
                            "type": "object",
                            "properties": {
                              "id": { "type": "string" },
                              "value": { "type": ["string", "number", "boolean"] }
                            },
                            "required": ["id", "value"],
                            "additionalProperties": false
                          }
                        ]
                      }
                    }
                  ]
                },
                "default": {
                  "type": ["string", "boolean", "number"],
                  "description": "Default value for the parameter. Unlike 'value', this will show the parameter as editable in the UI."
                }
              },
              "required": ["id"],
              "anyOf": [
                { "required": ["value"] },
                { "required": ["default"] }
              ],
              "additionalProperties": false
            },
            {
              "type": "array",
              "items": {
                "type": "object",
                "properties": {
                  "id": { "type": "string" },
                  "value": {
                    "oneOf": [
                      { "type": ["string", "boolean", "number"] },
                      {
                        "type": "array",
                        "items": {
                          "oneOf": [
                            { "type": "string" },
                            {
                              "type": "object",
                              "properties": {
                                "name": { "type": "string" },
                                "value": { "type": ["string", "number", "boolean"] }
                              },
                              "required": ["name", "value"],
                              "additionalProperties": false
                            },
                            {
                              "type": "object",
                              "properties": {
                                "id": { "type": "string" },
                                "value": { "type": ["string", "number", "boolean"] }
                              },
                              "required": ["id", "value"],
                              "additionalProperties": false
                            }
                          ]
                        }
                      }
                    ]
                  },
                  "default": {
                    "type": ["string", "boolean", "number"],
                    "description": "Default value for the parameter. Unlike 'value', this will show the parameter as editable in the UI."
                  }
                },
                "required": ["id"],
                "anyOf": [
                  { "required": ["value"] },
                  { "required": ["default"] }
                ],
                "additionalProperties": false
              }
            }
          ]
        },
        "template": { "type": "string" }
      },
      "oneOf": [
        { "required": ["command"] },
        { "required": ["script"] },
        { "required": ["properties"] },
        { "required": ["template"] }
      ],
      "errorMessage": {
        "oneOf": "Exactly one of 'command', 'script' or 'properties' must be present."
      },
      "additionalProperties": false
    }
  }
}
