{
  "execute_on": "ve",
  "name": "Configure LXC for OCI",
  "description": "Configures LXC container options for OCI images. Sets lxc.console.logpath.",
  "parameters": [
    {
      "id": "vm_id",
      "name": "ID of the virtual machine",
      "type": "number",
      "required": true,
      "description": "ID of the virtual machine"
    },{
        "id": "initial_command",
        "name": "Initial Command",
        "type": "string",
        "description": "Initial command to execute in the container (lxc.init_cmd). Useful for OCI images that require a specific start command.",
        "advanced": true
    }
  ],
  "commands": [
    {
      "name": "Configure OCI LXC options",
      "script": "oci-lxc-configuration.sh"
    }
  ]
}
