{
  "execute_on": "hook",
  "name": "Install ACME Cert Renewal",
  "description": "Deploys an on-start hook that handles ACME certificate issuance and renewal via acme.sh with Cloudflare DNS. The hook lives in /etc/proxvex/on_start.d/ and runs on every container start (and once now via hook_trigger_now).",
  "skip_if_all_missing": [
    "CF_TOKEN"
  ],
  "parameters": [
    "CF_TOKEN",
    "acme_san",
    "acme_email",
    "acme.cert_dir",
    "acme.needs_server_cert",
    "acme.needs_ca_cert",
    "acme_staging",
    "alpine_mirror",
    "debian_mirror"
  ],
  "commands": [
    {
      "script": "acme-renew-hook.sh",
      "description": "Deploy ACME renewal on-start hook (runs at deploy + every container start)"
    }
  ]
}
