{
  "name": "Upload enable-ssl.sh",
  "description": "Uploads enable-ssl.sh to initdb:enable-ssl.sh",
  "execute_on": "ve",
  "skip_if_all_missing": [
    "upload_enable_ssl_sh_content"
  ],
  "parameters": [
    {
      "id": "upload_enable_ssl_sh_content",
      "name": "enable-ssl.sh",
      "type": "string",
      "upload": true,
      "required": false,
      "advanced": false,
      "description": "Configuration file: enable-ssl.sh"
    },
    {
      "id": "upload_enable_ssl_sh_destination",
      "name": "Destination Path",
      "type": "string",
      "default": "initdb:enable-ssl.sh",
      "advanced": true,
      "description": "Target path: {volume_key}:{filename}"
    },
    {
      "id": "shared_volpath",
      "name": "Shared Volume Path",
      "type": "string",
      "advanced": true,
      "description": "Path to the shared volume mount point"
    },
    {
      "id": "hostname",
      "name": "Hostname",
      "type": "string",
      "required": true,
      "description": "Container hostname"
    },
    {
      "id": "uid",
      "name": "UID",
      "type": "string",
      "default": "0",
      "advanced": true,
      "description": "User ID for file ownership"
    },
    {
      "id": "gid",
      "name": "GID",
      "type": "string",
      "default": "0",
      "advanced": true,
      "description": "Group ID for file ownership"
    },
    {
      "id": "mapped_uid",
      "name": "Mapped UID",
      "type": "string",
      "default": "",
      "advanced": true,
      "description": "Mapped user ID for unprivileged containers"
    },
    {
      "id": "mapped_gid",
      "name": "Mapped GID",
      "type": "string",
      "default": "",
      "advanced": true,
      "description": "Mapped group ID for unprivileged containers"
    }
  ],
  "commands": [
    {
      "name": "Upload enable-ssl.sh",
      "script": "2-upload-enable-ssl-sh.sh",
      "library": "upload-file-common.sh",
      "outputs": [
        "upload_enable_ssl_sh_uploaded"
      ]
    }
  ]
}