{
  "execute_on": "ve",
  "name": "Write LXC Notes",
  "skip_if_property_set": "compose_file",
  "description": "Writes the container notes/description for standard (non-docker-compose) apps.\n\nSkipped for docker-compose apps (compose_file is set) - see 191-host-write-docker-compose-notes.json.\n\nThe notes contain:\n- Hidden markers for machine parsing (proxvex:managed, oci-image, application-id, etc.)\n- Visible Markdown content with application info, version, and links",
  "parameters": [
    "vm_id",
    "hostname",
    "template_path",
    "oci_image",
    "application_id",
    "application_name",
    "oci_image_tag",
    "deployer_base_url",
    "ve_context_key",
    "icon_base64",
    "icon_mime_type",
    "username",
    "uid",
    "gid",
    "is_deployer",
    "stack_id",
    "all_stack_ids",
    "deploy_params_b64"
  ],
  "commands": [
    {
      "name": "Write LXC Notes",
      "script": "host-write-lxc-notes.py",
      "library": "lxc-notes-common.py",
      "outputs": [
        "notes_written"
      ]
    }
  ]
}
