{
  "execute_on": "ve",
  "name": "Check Registry Mirror",
  "description": "Verifies the Docker Registry Mirror is working: DNS resolves locally, CA is trusted, and skopeo can inspect images through the mirror.",
  "parameters": [
    "hostname"
  ],
  "commands": [
    {
      "name": "Check Registry Mirror",
      "script": "check-registry-mirror.sh",
      "library": "skopeo-probe.sh"
    }
  ]
}
