{
  "name": "Enable SSL App Configuration",
  "description": "Application-specific SSL setup when the SSL addon is enabled. The default shared script is a no-op. Applications can override conf-enable-ssl-app.sh in their own scripts/ directory.",
  "execute_on": "ve",
  "parameters": [
    "hostname",
    "vm_id",
    "uid",
    "gid",
    "mapped_uid",
    "mapped_gid",
    "pg_client_cert",
    "pg_hba_content"
  ],
  "commands": [
    {
      "name": "Enable SSL App Configuration",
      "script": "conf-enable-ssl-app.sh",
      "outputs": [
        "ssl_app_enabled",
        "pg_mtls_enabled",
        {
          "id": "compose_file",
          "default": true
        }
      ]
    }
  ]
}
