{
  "execute_on": "ve",
  "name": "Configure LXC for OCI",
  "description": "Configures LXC container options for OCI images. Sets lxc.console.logpath.",
  "parameters": [
    "vm_id",
    "hostname",
    "initial_command",
    "envs",
    "extra_envs",
    "wait_for_network"
  ],
  "commands": [
    {
      "name": "Configure OCI LXC options",
      "script": "conf-oci-lxc-configuration.py"
    }
  ]
}